{
  "schema_version": "1.0.0",
  "manifest_version": "coverage-2026-07-11-v1",
  "coverage_owner": "mobile-ui-generator-maintainers",
  "frequency_snapshot": {
    "version": "sanitized-2026-07-11-v1",
    "metric": "aggregate_observation_count",
    "minimum_sample_count": 5,
    "tie_rule": "frequency_rank ascending; ties resolve by pair_id ascending",
    "source": "public-knowledge aggregate export"
  },
  "state_transitions": [
    "proposed",
    "approved",
    "generated",
    "build_verified",
    "render_verified",
    "published"
  ],
  "supported_categories": [
    {"id":"finance-banking","label":"Finance and banking"},
    {"id":"commerce-marketplace","label":"Commerce and marketplace"},
    {"id":"mobility-transportation","label":"Mobility and transportation"},
    {"id":"delivery-food-beverage","label":"Delivery, food, and beverage"},
    {"id":"community-social","label":"Community and social"},
    {"id":"messaging","label":"Messaging"},
    {"id":"content-media","label":"Content and media"},
    {"id":"ott-streaming","label":"OTT and streaming"},
    {"id":"music-audio","label":"Music and audio"},
    {"id":"travel-booking","label":"Travel and booking"},
    {"id":"education-books","label":"Education and books"},
    {"id":"fitness-health","label":"Fitness and health"},
    {"id":"medical-clinical","label":"Medical and clinical care"},
    {"id":"mental-health","label":"Mental health"},
    {"id":"parenting-childcare","label":"Parenting and childcare"},
    {"id":"pet-care","label":"Pet care"},
    {"id":"real-estate","label":"Real estate"},
    {"id":"beauty-wellness","label":"Beauty and wellness"},
    {"id":"dating","label":"Dating"},
    {"id":"recruiting-jobs","label":"Recruiting and jobs"},
    {"id":"productivity-business","label":"Productivity and business tools"},
    {"id":"ai-products","label":"AI products"},
    {"id":"iot-device-control","label":"IoT and device control"},
    {"id":"games","label":"Games"},
    {"id":"rewards-loyalty","label":"Rewards and loyalty"},
    {"id":"utilities-lifestyle","label":"Utilities and general lifestyle"}
  ],
  "supported_patterns": [
    {"id":"splash-launch","label":"Splash and launch"},
    {"id":"onboarding-tutorial","label":"Onboarding and tutorial"},
    {"id":"permissions","label":"Permissions"},
    {"id":"login-signup","label":"Login, signup, and identity"},
    {"id":"home-dashboard","label":"Home and dashboard"},
    {"id":"bottom-tabs","label":"Bottom tabs and app bars"},
    {"id":"search-discovery","label":"Search and discovery"},
    {"id":"filters-sorting","label":"Filtering and sorting"},
    {"id":"product-list","label":"Product or content list"},
    {"id":"product-detail","label":"Product or content detail"},
    {"id":"saved-items","label":"Saved items"},
    {"id":"cart-checkout","label":"Cart and checkout"},
    {"id":"payment-coupon","label":"Payment and coupon"},
    {"id":"account-wallet","label":"Account and wallet"},
    {"id":"transaction-history","label":"Transaction history"},
    {"id":"map-route","label":"Map and route"},
    {"id":"reservation-ticketing","label":"Reservation and ticketing"},
    {"id":"delivery-tracking","label":"Delivery tracking"},
    {"id":"feed-community","label":"Feed and community"},
    {"id":"chat","label":"Chat"},
    {"id":"notifications","label":"Notifications"},
    {"id":"writing-upload","label":"Writing and upload"},
    {"id":"viewer","label":"Viewer"},
    {"id":"recommendations","label":"Recommendation and curation"},
    {"id":"referral-rewards","label":"Referral and rewards"},
    {"id":"ai-assistant","label":"AI assistant"},
    {"id":"voice-recording","label":"Voice and audio recording"},
    {"id":"settings-support","label":"Settings and support"},
    {"id":"empty-state","label":"Empty state"},
    {"id":"error-state","label":"Error state"},
    {"id":"loading-state","label":"Loading state"},
    {"id":"success-state","label":"Success state"}
  ],
  "proof_pairs": ["finance-banking-login-signup","commerce-marketplace-cart-checkout","mobility-transportation-map-route","community-social-feed-community","messaging-chat"],
  "pairs": [
    {"pair_id":"finance-banking-home-dashboard","app_category":"finance-banking","ui_pattern":"home-dashboard","user_job":"Review balance and next money action","rationale":"A compact financial home makes balance, risk context, and one primary action scannable.","layout_archetype":"dashboard","risk_tier":"high","required_states":["default","loading","error"],"languages":["ko","en"],"owner":"coverage-finance","basis":{"kind":"sanitized_knowledge","snapshot_version":"sanitized-2026-07-11-v1","metric_rank":1},"frequency_rank":1,"release_state":"approved"},
    {"pair_id":"finance-banking-login-signup","app_category":"finance-banking","ui_pattern":"login-signup","user_job":"Authenticate before viewing protected money data","rationale":"Trust-sensitive authentication needs explicit identity, validation, and recovery paths.","layout_archetype":"form","risk_tier":"high","required_states":["default","focused","validation_error","success"],"languages":["ko","en"],"owner":"coverage-finance","basis":{"kind":"product_rationale","snapshot_version":"sanitized-2026-07-11-v1","metric_rank":2},"frequency_rank":2,"release_state":"approved"},
    {"pair_id":"commerce-marketplace-product-list","app_category":"commerce-marketplace","ui_pattern":"product-list","user_job":"Compare products and choose a shortlist","rationale":"List cards expose image, price, availability, and comparison affordances without clipping.","layout_archetype":"list-grid","risk_tier":"medium","required_states":["default","loading","empty","error"],"languages":["ko","en"],"owner":"coverage-commerce","basis":{"kind":"sanitized_knowledge","snapshot_version":"sanitized-2026-07-11-v1","metric_rank":3},"frequency_rank":3,"release_state":"approved"},
    {"pair_id":"commerce-marketplace-cart-checkout","app_category":"commerce-marketplace","ui_pattern":"cart-checkout","user_job":"Confirm items, delivery, and total before ordering","rationale":"Checkout must keep totals, shipping, consent, and the primary purchase action visible.","layout_archetype":"form","risk_tier":"high","required_states":["default","focused","validation_error","success","destructive_confirmation"],"languages":["ko","en"],"owner":"coverage-commerce","basis":{"kind":"sanitized_knowledge","snapshot_version":"sanitized-2026-07-11-v1","metric_rank":4},"frequency_rank":4,"release_state":"approved"},
    {"pair_id":"mobility-transportation-map-route","app_category":"mobility-transportation","ui_pattern":"map-route","user_job":"Find a route and understand arrival context","rationale":"The map remains primary while route steps and action controls respect safe areas.","layout_archetype":"map-overlay","risk_tier":"medium","required_states":["default","loading","error","permission_denied"],"languages":["ko","en"],"owner":"coverage-mobility","basis":{"kind":"sanitized_knowledge","snapshot_version":"sanitized-2026-07-11-v1","metric_rank":5},"frequency_rank":5,"release_state":"approved"},
    {"pair_id":"mobility-transportation-reservation-ticketing","app_category":"mobility-transportation","ui_pattern":"reservation-ticketing","user_job":"Reserve a trip and retain a scannable ticket","rationale":"Reservation confirmation needs immutable trip facts and a resilient ticket state.","layout_archetype":"detail-action","risk_tier":"high","required_states":["default","loading","error","success"],"languages":["ko","en"],"owner":"coverage-mobility","basis":{"kind":"product_rationale","snapshot_version":"sanitized-2026-07-11-v1","metric_rank":6},"frequency_rank":6,"release_state":"approved"},
    {"pair_id":"delivery-food-beverage-product-list","app_category":"delivery-food-beverage","ui_pattern":"product-list","user_job":"Browse nearby food options and prices","rationale":"Dense list rows balance image recognition, dietary cues, price, and delivery time.","layout_archetype":"list-grid","risk_tier":"low","required_states":["default","loading","empty","error"],"languages":["ko","en"],"owner":"coverage-delivery","basis":{"kind":"sanitized_knowledge","snapshot_version":"sanitized-2026-07-11-v1","metric_rank":7},"frequency_rank":7,"release_state":"approved"},
    {"pair_id":"delivery-food-beverage-delivery-tracking","app_category":"delivery-food-beverage","ui_pattern":"delivery-tracking","user_job":"Track an order and contact support when delayed","rationale":"Timeline progress and map context should remain readable during changing delivery states.","layout_archetype":"timeline-map","risk_tier":"medium","required_states":["default","loading","error","success"],"languages":["ko","en"],"owner":"coverage-delivery","basis":{"kind":"product_rationale","snapshot_version":"sanitized-2026-07-11-v1","metric_rank":8},"frequency_rank":8,"release_state":"approved"},
    {"pair_id":"community-social-feed-community","app_category":"community-social","ui_pattern":"feed-community","user_job":"Scan updates and open a relevant discussion","rationale":"A feed needs predictable rhythm, clear authorship, and stable actions around variable copy.","layout_archetype":"feed","risk_tier":"medium","required_states":["default","loading","empty","error"],"languages":["ko","en"],"owner":"coverage-community","basis":{"kind":"sanitized_knowledge","snapshot_version":"sanitized-2026-07-11-v1","metric_rank":9},"frequency_rank":9,"release_state":"approved"},